,title,score,id,subreddit,url,num_comments,body,created
37,Artificial price inflation question.,23,toeaum,BitcoinBeginners,https://www.reddit.com/r/BitcoinBeginners/comments/toeaum/artificial_price_inflation_question/,66,"I was chatting with a friend of mines father who is an old school (in his 70s) stock broker about Bitcoin.

He suggested that Bitcoin can be manipulated by “whales” who agree to quickly and in large quantity exchange coinage to pump the price, as has been done on the stock exchange and is a big Nono by the SEC.

I have a pretty good understanding of blockchain and Bitcoin in general, but dident have a good reply as to why this is not potentially a problem. 

Hoping someone can answer.",1648261219.0
45,Paypal,31,tok1pc,BitcoinBeginners,https://www.reddit.com/r/BitcoinBeginners/comments/tok1pc/paypal/,49,"is just me or does buying bitcoin with PayPal, seems a bit naïve, they can shut down and and take your funds anytime they want",1648282832.0
54,"Just a reminder: If Bitcoin is widely adopted, we're all going to die, this is not a joke' 🤣",1779,tp1ep3,Bitcoin,https://v.redd.it/nkti6c3d7sp81,465,,1648323785.0
46,Talking About Sats,21,tp6gxb,BitcoinBeginners,https://www.reddit.com/r/BitcoinBeginners/comments/tp6gxb/talking_about_sats/,41,"How are we actually supposed to talk about sats in terms of more than just decimal places? How do I verbally communicate how many sats I'm at? 

For example: right now, $5 on Strike will get me 0.00011218 BTC. Am I to understand this as 11,218 sats? Does that change as the number the BTC is further divisible? 

I feel dumb asking that question but I'm just thinking back to pre school learning about dollars, cents, etc for the first time",1648334646.0
35,This is Crypto History (Ethereum to be precise) !!!,7,tp9ha6,ethereum,https://forum.makerdao.com/t/mip6-huntingdon-valley-bank-loan-syndication-collateral-onboarding-application/14219,4,,1648344383.0
42,"More Than 2,000 Addresses Are Now Holding At Least 1,000 Bitcoins",30,tpbins,Bitcoin,https://bobosandwojaks.com/more-than-2000-addresses-are-now-holding-at-least-1000-bitcoins/,9,,1648351734.0
57,Rio de Janeiro to accept Bitcoin for real estate taxes from 2023,66,tpd4pt,CryptoCurrency,https://cointelegraph.com/news/rio-de-janeiro-to-accept-bitcoin-for-real-estate-taxes-from-2023,30,,1648358073.0
19,😊,1632,tpeg1a,Bitcoin,https://i.redd.it/9yro9vlnivp81.jpg,103,,1648363932.0
51,Rio De Janeiro To Enable Crypto Tax Payments Starting Next Year,17,tpf3q3,CryptoCurrency,https://bitcoinist.com/rio-de-janeiro-to-enable-crypto-tax/,5,,1648367027.0
50,Argentines receive salary in cryptocurrencies to escape exchange control and high inflation,120,tpfaps,CryptoCurrency,https://digesttime.com/2022/03/26/argentines-receive-salary-in-cryptocurrencies-to-escape-exchange-control-and-high-inflation/,30,,1648367936.0
17,"This ‘Insane’ Crypto Sector Is the Next Big Thing, According to Macro Guru Raoul Pal - The Daily Hodl",0,tpffgp,CryptoCurrency,https://dailyhodl.com/2022/03/27/this-insane-crypto-sector-is-the-next-big-thing-according-to-macro-guru-raoul-pal/,17,,1648368498.0
25,Dubai café to accept cryptocurrencies as payment for purchases,28,tpg06r,CryptoCurrency,https://www.khaleejtimes.com/economy/dubai-cafe-bake-n-more-to-accept-cryptocurrencies-as-payment-for-purchases,12,,1648371261.0
4,Loopring (LRC) Gained 38% Price After GameStop Integration News,576,tpg0sp,CryptoCurrency,https://bitcoinik.com/loopring-lrc-gained-38-price-after-gamestop-integration-news/,161,,1648371344.0
34,"Ditch Chrome, go for Brave browser!",1,tpgghb,CryptoCurrency,https://www.reddit.com/r/CryptoCurrency/comments/tpgghb/ditch_chrome_go_for_brave_browser/,49,"As I read a post that said you should update Chrome in order not to get hacked etc I couldn't ask myself: why would you use chrome if there is Brave? I see that mine updated by itself.

Brave browser is one of the best browser there is. And you want to know why? Because it's built on pure blockchain foundations. You install it on your PC or phone, create a wallet and then bam! You get paid in BAT (Brave's cryptocurrency) for every ad that you receive. And the ad is not annoying at all. It's just a notification that you don't need to click to obtain your BAT.

Another extremely good thing about Brave is that it blocks trackers (it shows on the front page when you open it how many trackers it has blocked) and it has a built in adblocker for those pesky pop-ups and ads (except Brave's ads, of course).

It also saves you data usage and hours in time saved. For example my front page tells me that Brave blocked 136 059 trackers and ads, saved me 3.17 GB bandwidth and 1.9 hours. Thanks, Brave team!

So you have this: Brave, a blockchain decentralized browser that pays you in BAT for using it, blocks trackers, ads, gives you time and more bandwidth vs. Chrome that literally shits on you, stealing your data and what not.

I highly recommend it because it's also fast. You choose what browser you want to use, but from first hearing about Brave I never used another browser since except this good boy.

Cheers!

Edit: as some people mentioned. Brave is not a decentralized browser. My mistake. But the team behind it is the same as the one behind BAT, a decentralized blockchain token.",1648373465.0
12,DCA into Bitcoin and Ethereum,3,tpgugk,CryptoCurrency,https://www.reddit.com/r/CryptoCurrency/comments/tpgugk/dca_into_bitcoin_and_ethereum/,22,"What is the best way to DCA into Bitcoin and Ethereum? I currently have a recurring payment set up to purchase both weekly through Binance, but I’m unsure if this is the best way around it as I have seen posts saying Binance often purchases them at a higher price than what they are and that the withdraw fees on Binance make it not worth it. I want to have something that I just set up through my card and it purchases weekly without me having to remember about it. I know people will tell me to store it in a hardware wallet, but for the amount I have at the minute and for the foreseeable future i would prefer to be able to earn interest on it by staking it or something, does anyone else do this?",1648375262.0
55,NPR wrote a feature story on Bitcoin in El Salvador,27,tph10z,Bitcoin,https://www.npr.org/2022/03/27/1086851329/el-salvadors-leader-wants-to-go-in-even-bigger-on-bitcoin,17,,1648376078.0
53,Does no one think it's sketch that the Apes(all of them) is funded by a VC Firm?,46,tph2x3,CryptoCurrency,https://www.reddit.com/r/CryptoCurrency/comments/tph2x3/does_no_one_think_its_sketch_that_the_apesall_of/,69,"I just find it quite odd that the largest NFT projects, the Ape Series(Bored, Yacht, etc.) is completely backed by a major silicon valley VC Firm. I personally don't trust that the backing is from a institutional group with a lot of unknown hands in the pot.
VC Firm: Andreessen Horowitz (a16z)
AUM: $18.8B (pre-launch of Apes)
I realize that they weren't the ones that created, but instead funded the creators(Yuga Labs). I just think it's not within my comfort zone.
I haven't been able to find any information about the founders having coding experience or even what their previous jobs were. Feel free to list their experiences in the comments.
With the creation of Ape Coin, this could be a project that will stay, but I fear it may be only hype due to lack of experience and interests from the VC firm making the situation too big to handle. Some of the yields described by people for when the meta verse goes live for the Apes projects, makes this feel unsustainable.
I might be tripping, but this reminds me of some other projects from late 2017/early 2018 that went bust and decimated the market.",1648376325.0
47,Help me understand bitcoin mining statistics by @JonPDiGiacomo,7,tphqzy,Bitcoin,https://v.redd.it/e6urstviswp81,1,,1648379352.0
0,Help me understand bitcoin mining statistics by @JonPDiGiacomo,8,tphqzy,Bitcoin,https://v.redd.it/e6urstviswp81,1,,1648379352.0
49,Always have said that this guy is a scammer,37,tphsgf,CryptoCurrency,https://cryptoslate.com/report-justin-sun-accused-of-insider-trading-and-gaming-the-crypto-market-system/,35,,1648379529.0
13,Always have said that this guy is a scammer,38,tphsgf,CryptoCurrency,https://cryptoslate.com/report-justin-sun-accused-of-insider-trading-and-gaming-the-crypto-market-system/,35,,1648379529.0
16,"Beautiful explanation of the EVM from Preethi Kasireddy.... ""Solidity Code Compiles to EVM Bytecode, Which Is Understood By EVM-Compatible Chains"" (short audio clip)",0,tpihn0,ethereum,https://podclips.com/c/KSmJWP?ss=r&ss2=ethereum&d=2022-03-27,5,,1648382410.0
7,U.S. Congressman Pete Sessions: ‘Bitcoin Is Aligned With American Values’,14,tpimju,CryptoCurrency,https://www.cryptoglobe.com/latest/2022/03/u-s-congressman-pete-sessions-bitcoin-is-aligned-with-american-values/?utm_source=delta.app&utm_medium=mobile&utm_campaign=delta-direct&utm_term=ios,20,,1648382941.0
36,Let’s play; Is It a Shill or Is It FUD?,4,tpj21g,CryptoCurrency,https://www.reddit.com/r/CryptoCurrency/comments/tpj21g/lets_play_is_it_a_shill_or_is_it_fud/,40,"We all know those posts where you post a coin and we roast it, those old posts that are no longer allowed that say ‘I have $1000 how should I invest it?’, and those opinion pieces about u/vbuterin ‘s political thoughts or Senator Karen’s ‘warnings’ about us degens.                

But let’s play a new game, comment a comment that you’ve seen typed out WAY too often and we can decide if it is a shameless shill or baseless FUD?         

I’ll start, “Each Bitcoin transaction consumes 1,173 kilowatt hours of electricity which could power the typical American home for six weeks!”",1648384648.0
5,Logic of staking rewards post-merge,10,tpj3di,ethereum,https://www.reddit.com/r/ethereum/comments/tpj3di/logic_of_staking_rewards_postmerge/,7,"I heard mention that staking rewards will be 10-15% after the merge. What's the reason for this, if it's correct, and will it be a temporary state of affairs until rewards move back down to the 3-5% range?",1648384790.0
40,50% of Germans Are Ready to Invest in Crypto,59,tpjlkj,CryptoCurrency,https://cryptopotato.com/nearly-50-of-germans-are-ready-to-invest-in-crypto-report/,57,,1648386521.0
41,Exploring The Correlation Between Bitcoin Price And Google Search Trends,4,tpjn1d,Bitcoin,https://cryptonews.net/4242835/,0,,1648386662.0
38,Brazil's City Rio de Janeiro to Start Accepting Payments in Bitcoin and Cryptos for Taxes on Real,12,tpjoyd,CryptoCurrency,https://timestabloid.com/brazilian-city-rio-de-janeiro-to-start-accepting-payments-in-bitcoin-and-cryptos-for-taxes-on-real-estate/,14,,1648386850.0
32,Canadian Authorities Having Trouble Seizing All Bitcoin Donations for Freedom Convoy Truckers,21,tpjuyz,CryptoCurrency,https://www.cryptoglobe.com/latest/2022/03/canadian-authorities-having-trouble-seizing-all-bitcoin-donations-for-freedom-convoy-truckers/,18,,1648387441.0
56,Now you can buy properties in Dubai with Bitcoin - Top Real Estate Developer now Accepts Bitcoin as Payment For all Properties,69,tpjvl7,Bitcoin,https://startupfortune.com/dubais-top-real-estate-developer-to-accept-cryptocurrency-as-payment-for-all-properties/,12,,1648387503.0
21,Now you can buy properties in Dubai with Bitcoin - Top Real Estate Developer now Accepts Bitcoin as Payment For all Properties,72,tpjvl7,Bitcoin,https://startupfortune.com/dubais-top-real-estate-developer-to-accept-cryptocurrency-as-payment-for-all-properties/,12,,1648387503.0
30,Now you can buy properties in Dubai with Bitcoin - Top Real Estate Developer now Accepts Bitcoin as Payment For all Properties,69,tpjvl7,Bitcoin,https://startupfortune.com/dubais-top-real-estate-developer-to-accept-cryptocurrency-as-payment-for-all-properties/,12,,1648387503.0
3,How Block's New Wallet Works,6,tpkdrw,Bitcoin,https://wallet.build/how-the-wallet-works/,3,,1648389136.0
39,How Block's New Wallet Works,7,tpkdrw,Bitcoin,https://wallet.build/how-the-wallet-works/,3,,1648389136.0
22,How Block's New Wallet Works,8,tpkdrw,Bitcoin,https://wallet.build/how-the-wallet-works/,3,,1648389136.0
10,I went to metaverse fashion week and it was like a nightmare – I fell off a boat,5,tpkgb1,CryptoCurrency,https://www.the-sun.com/tech/4975202/metaverse-fashion-week-fell-off-yacht/,28,,1648389361.0
58,Inside plans for 'crypto paradise' island where super rich could live in 2023,4,tpknzx,CryptoCurrency,https://www.the-sun.com/tech/4975707/inside-plans-for-satoshi-island-crypto-nft/amp/,38,,1648389991.0
20,What Bear Market? Zilliqa Rallies 116% on Agora Tie-Up,0,tpl7k0,CryptoCurrency,https://cryptobriefing.com/what-bear-market-zilliqa-rallies-100-agora-tie-up/,16,,1648391745.0
14,Is BTC about to crash or is it just waiting for the alts to catch up before it finally breaks through the resistance barrier it's been pressed up against this week?,11,tplalf,CryptoCurrency,https://www.reddit.com/r/CryptoCurrency/comments/tplalf/is_btc_about_to_crash_or_is_it_just_waiting_for/,97,"Title says it all, it would seem that BTC has been struggling to break the £34k ($45k) barrier ever since it dropped below it right back at the start of the year. Although it made a few attempts before they quickly dipped back down.

This time it has reached the barrier and not only stayed steady but has slightly been trending upwards. Also this time the alts have finally been pumping up with it after dipping far harder throughout 2022 than BTC. I can only imagine that the big money is being preferentially targeted towards these undervalued alts at the present.

However, the alts are quickly reaching the point where they are even with their drop from ATH as BTC is. Some people are calling for this to be the sign that a huge crash is coming but I believe that it's more likely that once the alts have caught up that the 'big money' is going to go back to pushing BTC hard.

Thoughts?",1648392008.0
9,"""Keep Your Coins"" Bill",5,tplclm,CryptoCurrency,https://www.congress.gov/bill/117th-congress/house-bill/6727/text?q=%7B%22search%22%3A%5B%22H.R.+6727%22%2C%22H.R.%22%2C%226727%22%5D%7D&r=2&s=1,12,,1648392181.0
29,Vitalik Buterin admits 'fees are a huge problem' for Ethereum’s usability | Finbold,194,tplivy,ethereum,https://finbold.com/vitalik-buterin-admits-fees-are-a-huge-problem-for-ethereums-usability/,38,,1648392742.0
31,Algorand Settling Over 11M transactions in 7 days With Zero Downtime in 3 Years,23,tpllao,CryptoCurrency,https://thecryptobasic.com/2022/03/26/algorand-records-sensational-feats-in-several-aspects-settling-over-11m-transactions-in-7-days-with-zero-downtime-in-3-years/,22,,1648392963.0
27,Sebastian Maniscalco Becomes First Stand-Up Comedian to Gift NFTs to Showgoers,9,tplywf,CryptoCurrency,https://variety.com/2022/digital/news/sebastian-maniscalco-free-nft-1235213438/,24,,1648394077.0
48,It's Official: EU Says No to Provisions Restricting Bitcoin,95,tpmovo,CryptoCurrency,https://cryptopotato.com/its-officialeu-says-no-to-provisions-restricting-bitcoin/,38,,1648396246.0
43,ETH Due For An Explosive Move As ‘Ethereum Merge’ Google Searches Spike To Unprecedented Highs,46,tpmqfb,CryptoCurrency,https://zycrypto.com/eth-due-for-an-explosive-move-as-ethereum-merge-google-searches-spike-to-unprecedented-highs/,41,,1648396374.0
18,"Just as Hal Finney Predicted, Bitcoin Is Being Purchased to Act as a Reserve Currency",150,tpmqt0,CryptoCurrency,https://finance.yahoo.com/news/just-hal-finney-predicted-bitcoin-145000564.html,87,,1648396405.0
23,Improving my seed phrase storage,861,tpmtg2,Bitcoin,https://i.redd.it/1ivxo5jv7yp81.jpg,202,,1648396621.0
8,"I did the math. Using stadistics from the last 5 years, best day of the week to buy BTC is Friday's night and to sell is Wednesday's night.",18,tpnbii,CryptoCurrency,https://www.reddit.com/r/CryptoCurrency/comments/tpnbii/i_did_the_math_using_stadistics_from_the_last_5/,73,"Hi guys,

This is what I did, I downloaded the daily prices from BTC from March 2018 until today (March 2022), using Investing data.

That gave me around 208 weeks.

Then I checked the end price of each day (end price of ""currenct"" day means start p´rice of ""next"" day)

That gave me the following results:

&#x200B;

|Weekday|Total|Gain|Loss|
|:-|:-|:-|:-|
|Sunday|209|109 (52%)|100 (48%)|
|Monday|208|99 (48%)|109 (52%)|
|Tuesday|207|105 (51%)|102 (49%)|
|Wednesday|209|118 (56%)|91 (44%)|
|Thrusday|207|96 (46%)|119 (54%)|
|Friday|209|112 (54%)|97 (46%)|
|Saturday|209|125 (60%)|84 (40%)|

How to read it?

Saturday having 60% ""Gain"" means 60% of the Saturdays price ended up being higher at the end of the day than at the beggining (Friday night).

Thursday having 54% ""Loss"" means 54% of the Thursdays price ends being lower at the end of the day than tha the beggining (Wednesday night)

Don't know what to do with this info, but found it intesting. Maybe instead of daily traders we get weekly trades?

What do you think?

Note: This is using Investing data, so it's adjusted at their timezone.",1648398055.0
33,"Crystal Hefner follows InkFinks, you should too!",0,tpnhrh,ethereum,https://www.reddit.com/r/ethereum/comments/tpnhrh/crystal_hefner_follows_inkfinks_you_should_too/,0,"Check out this brand new promising project on Eth! Mint coming soon!!!

Discord here: https://discord.gg/inkfinks

**__What is InkFinks? __**
InkFinks is a collection of 8,888 NFTs which will act as the first chapter of a larger narrative, continuously unravelling through future multimedia projects. Inspired by traditional animation and pop culture, each piece features hand-drawn traits and water-colour backgrounds painted by emerging artist, Mr. Bear. 

The Incredible World of InkFinks is a zany multimedia universe, overseen personally by its creators, Mr. Bear <a:BearWave:943353410370015233>  & The Toon Tycoon <a:TTMoney:941596264733220874>  Our past, present, and future will all be revealed through various mediums of storytelling. This means the story unravels through animations, comics, physical art, written narrative, audio formats, and more! 

**__Mission & Vision__**
“Our promise is to be unwavering in our pursuit of creating connection within our community, through high-quality art and authentic entertainment” - Mr. Bear & The Toon Tycoon, Creators of InkFinks. 

By owning an InkFink NFT, you have the chance to get in on the ground floor of a tower that never stops construction… Our dream is decades of noise complaints! 

**__Wen Mint & What Blockchain? __**
InkFinks will mint on the Ethereum blockchain at the end of Q1 2022 <:cheekyfink:944124241635332116> 

**__How many InkFinks will there be? __**
The initial drop will include 8,888 generative OG InkFinks that need loving homes! 

Additionally, **The Creators will be dropping unique one-of-one (1:1) pieces at random**. As of right now, these pieces are intended to help offset our marketing and startup costs. These 1:1’s will be one-of-a-kind pieces, straight from the minds of Mr. Bear and The Toon Tycoon. Plus, you never know what sort of future use they may get you! <a:inkwink:941249606140985354> 

**__Who is on the Team?__**
The InkFinks Team is built up of adorable bears, crass dogs, award winning marketers, web3 visionaries, serial entrepreneurs, live event experts, and really really good looking people. Learn more at <#925895282326143008> 

**__What do I get? __**
Aside from getting to own one of the most unique, high-quality pieces of art in the NFT space, you’ll also get access to a slew of other perks!

**Hodling an InkFink NFT will be your all-access pass to the future of the brand. Owners will receive select priority access to future drops, physical sketches and gifts from The Creators, and be granted permission into a top secret channel where Mr. Bear and The Toon Tycoon will drop the alpha on all future projects. **

Don’t miss your opportunity to get in on the ground floor of a building that never stops construction! 

**__How did InkFinks start? __**
Check out <#926020672600293396> to get up to speed on the whole story! Our past, present, and future will all be revealed through various mediums of storytelling. This means the story unravels through animations, comics, physical art, written narrative, audio formats, and more! 

Some aspects of the narrative will need to be unlocked by the community. Keep your eyes on <#925644979198656562> for all future opportunities to unlock more parts of the story! 

**__What’s that grey bear thing you have as your mascot? __** 
You must be talking about Smoker Bear! <a:inkwink:941249606140985354> He’s the face of InkFinks, similar to how Alfred E. Neuman was the face of MAD Magazine.. savvy? 

Aside from The Creators, he’s one of the most important figures in the InkFinks universe (not to mention that he’s the main base used for Mr. Bear’s generative art pieces). We’ll be showing you more of Smoker Bear in the future.",1648398576.0
11,"Just as Hal Finney Predicted, Bitcoin Is Being Purchased to Act as a Reserve Currency",17,tpnqwr,CryptoCurrency,https://www.coindesk.com/markets/2022/03/27/just-as-hal-finney-predicted-bitcoin-is-being-purchased-to-act-as-a-reserve-currency/,12,,1648399316.0
6,I‘m afraid this upcoming EU crypto vote is not getting the attention it requires - EU tries to ban self hosted wallets 🇪🇺⛔️,40,tpojrj,CryptoCurrency,https://twitter.com/paddi_hansen/status/1507741894494855168?s=21,22,,1648401655.0
59,UK Set to Disclose Plans for Regulating Crypto in Coming Weeks: CNBC,3,tpop6z,CryptoCurrency,https://ca.sports.yahoo.com/news/uk-set-disclose-plans-regulating-155106231.html?src=rss,6,,1648402117.0
1,Caught this in The Simpsons intro (S26; E1) & thought “I know who’ll appreciate this.”,150,tpp3y6,Bitcoin,https://i.redd.it/7qnfeoqwryp81.jpg,15,,1648403344.0
24,Podcast: Crypto Island,0,tpqajv,CryptoCurrency,https://www.reddit.com/r/CryptoCurrency/comments/tpqajv/podcast_crypto_island/,8,"It’s hosted by PJ Vogt, who was formerly a host on the podcast Reply All.

This is not a crypto news or education podcast. Instead it’s a side take on crypto culture. There are  some really interesting stories that have you cheering for the crypto backers in surprising ways. The first episode (not the trailer) covers ConstitutionDAO, which you don’t have to know anything about in advance. High level, it’s a community of crypto trying to buy the US constitution. It’s explained very well. It’s not dry at all. 

It’s a good listen if people need something new. Clearly I am trying to hit my character minimum here…

Has anyone else given it a shot?",1648406802.0
44,What is your solution for ETH?,0,tpqhjg,ethereum,https://www.reddit.com/r/ethereum/comments/tpqhjg/what_is_your_solution_for_eth/,3,"Ethereum network costs on Layer 2 protocols have dropped to their lowest level in seven months, after a reduction in ETH gas fees across the board, I'd want to discuss it with you since, as you can see, we've had a lot of troubles with ETH in the previous few months.  


I was wondering whether you utilize any DeFi services to help you cope with all of these ETH concerns. Because there are so many possibilities now, I feel it will be tough to pick just one, which is why I felt forced to try a few of them.  


Kaiba is my first choice since it appears to be a fast and cheap blockchain based on PoA consensus, and I've found it to be significantly faster and cheaper than Ethereum. I've also tried their KaibaSwap, and I'm pleased with how it works. I'm not sure why the previous time I tried Balancer, it didn't work well for me.  


What DeFi services do you utilize, and what solution do you have?",1648407356.0
15,"Can someone explain to a newbie what a ""memo"" is and how to find the necessary info? I recently lost a transaction because I didn't know what needed to be included.",5,tpr1bq,CryptoCurrency,https://www.reddit.com/r/CryptoCurrency/comments/tpr1bq/can_someone_explain_to_a_newbie_what_a_memo_is/,21,"What I’m looking for:  I’m very much a beginner in crypto, and am still puzzled by this “memo” thing.  I am looking more for “how to make sure I don’t mess up a transaction” lesson than a “why it’s important” lesson, although I wouldn’t mind that as well.  YouTube and other sources haven’t been very helpful.  What I really need is (1) where to find the necessary information to put in a memo and (2) what exactly needs to be included in the memo.

Background:  I tried to move a small amount of CRO from my DEFI Wallet back to the Crypto.com wallet on the app.  Let’s not get into why or if this is good/bad.  I didn’t understand what a “memo” was, and just wrote a note to myself.  Long story short, the transaction never went through (include in this moment my life lesson of always trying a small transaction first).  When I contacted support, they said the transaction wasn’t going to go through because I didn’t have the correct memo, but they could undo the transaction for a flat fee of $50, which would wipe out what I was trying to transfer.  So, it’s basically lost.   I'd like to avoid this in the future.",1648408910.0
28,Russia will take Bitcoin as payment for Oil and Gas.,3,tpriqv,Bitcoin,https://youtube.com/watch?v=BA1Zk7MBAE4&feature=share,2,,1648410267.0
2,Russia will take Bitcoin as payment for Oil and Gas.,2,tpriqv,Bitcoin,https://youtube.com/watch?v=BA1Zk7MBAE4&feature=share,2,,1648410267.0
52,Question about Bitcoin atms??,1,tps7lv,Bitcoin,https://www.reddit.com/r/Bitcoin/comments/tps7lv/question_about_bitcoin_atms/,7,If I were to send Bitcoin using an atm to someone else’s address is it possible to still access blockchain to check how many confirmations the transaction has? or is there anyway to check how many confirmations a transaction has that was sent from a Bitcoin ATM??,1648412226.0
